{"central_claim_cycle":{"central_claim_id":"CLAIM-REMOTE-TRUST-UNIVERSAL","counterfactual":"若同一组织在可比团队中改善文档、反馈、新人桥接和申诉保护后信任下降停止，则地点本身的必然机制失去支持；若改善后仍持续下降，则弱联系路径权重上升。","initial_judgment":"当前拒绝远程办公必然摧毁组织信任这一全称命题，但只给 moderate 强度。","revision":"把对“必然摧毁”的否定保持为 moderate，并把全远程、互赖度、反馈质量、新人处境与时间窗写成撤回门，而不是宣称远程办公通常无害。","strongest_attack":"在高度互赖、长期全远程、低文档化、低反馈且新人占比较高的组织中，远程办公可能通过非正式线索与弱联系持续丧失而显著侵蚀组织信任。","withdrawal_conditions":["出现组织内重复测量、可比基线与跨岗位一致下降，并在治理修复后仍持续时，重开裁决。","发现低权力成员遭受报复、隐私侵害或不可逆岗位损失时，停止方案排序并转入保护审查。"]},"central_claim_id":"CLAIM-REMOTE-TRUST-UNIVERSAL","choice_boundary":"分析可以比较结构解释力、风险与可逆性并提出补证顺序；真实办公安排、测量、岗位调整、退出与救济只能由另行确认的授权主体依程序选择。","claims":[{"authorization_ceiling":"仅检验全称命题，不授权现实处置或组织政策。","claim_id":"CLAIM-REMOTE-TRUST-UNIVERSAL","claim_type":"structural","concept_ids":["V8-CANON-EVIDENCE-CONTRACT","V8-CANON-APP-ORG","V8-CANON-D0-SP","V8-CANON-D3","V8-CANON-E5","V8-CANON-U07","V8-CANON-CIRCLE-CANDIDATE","V8-CANON-MULTICIRCLE-JOINT-OBJECT","V8-CANON-VOCAB-CONDITION-CHANNEL-MATERIAL","V8-CANON-VOCAB-CONDITION-CHANNEL-EXPERIENTIAL-MEANING","V8-CANON-VOCAB-CLOCK-INTERACTION","V8-CANON-CROSS-CIRCLE-CASCADE-MEANING","V8-CANON-BRANCHING-PATH-GRAPH","V8-CANON-PROTECTION-FLOOR","V8-CANON-SEL-AGT"],"confidence":"medium","evidence_refs":["USER-MATERIAL-1","V8-P0451"],"statement":"远程办公必然摧毁组织信任"}],"forecast_conditions":["只有在对象、基线、办公形式、重复测量和竞争机制均冻结后，才把路径排序升格为条件前瞻。","只有早期信号连续出现且反向信号未出现时，才提高相应路径权重。","任何预测都不得提高 J 轴授权范围，保护底板失败时停止升格。"],"mechanisms":[{"claim_ids":["CLAIM-REMOTE-TRUST-UNIVERSAL"],"distinguishing_conditions":["远程制度透明度、反馈回路与申诉保护的质量","任务互赖高但文档化、可见责任和修复写回充分"],"label":"治理与反馈中介机制","mechanism_id":"MECH-GOVERNANCE-FEEDBACK"},{"claim_ids":["CLAIM-REMOTE-TRUST-UNIVERSAL"],"distinguishing_conditions":["长期全远程且跨团队非正式接触持续减少","新人占比高、任务互赖强而弱联系替代通道不足"],"label":"媒介收缩与弱联系损失机制","mechanism_id":"MECH-WEAK-TIES"},{"claim_ids":["CLAIM-REMOTE-TRUST-UNIVERSAL"],"distinguishing_conditions":["岗位的协作依赖、资历与照护资源分布不均","评价与协调成本被转嫁给低权力成员"],"label":"岗位—成员异质性与成本重分配机制","mechanism_id":"MECH-POSITION-HETEROGENEITY"}],"path_edges":[{"condition":"若治理缺口先于信任变化且修复后反向信号出现，则治理中介路径领先。","edge_id":"EDGE-BASE-GOVERNANCE","from_node_id":"NODE-BASELINE-UNKNOWN","mechanism_ids":["MECH-GOVERNANCE-FEEDBACK"],"outcome_writeback":"把反馈质量、申诉安全和修复结果写回互动与组织时钟。","to_node_id":"NODE-GOVERNANCE-OUTCOME"},{"condition":"若长期全远程伴随桥接关系持续损失且新人影响更强，则弱联系路径上升。","edge_id":"EDGE-BASE-WEAK-TIES","from_node_id":"NODE-BASELINE-UNKNOWN","mechanism_ids":["MECH-WEAK-TIES"],"outcome_writeback":"把跨团队桥接、非正式反馈来源与新人社会化写回网络和互动时钟。","to_node_id":"NODE-WEAK-TIES-OUTCOME"},{"condition":"若成本与信任变化按岗位、资历和照护资源分化，则成本重分配路径上升。","edge_id":"EDGE-BASE-HETEROGENEITY","from_node_id":"NODE-BASELINE-UNKNOWN","mechanism_ids":["MECH-POSITION-HETEROGENEITY"],"outcome_writeback":"按员工、管理者、新人和岗位互赖写回分布结果，不以均值覆盖局部损害。","to_node_id":"NODE-HETEROGENEITY-OUTCOME"}],"path_nodes":[{"early_signals":["能够取得分层基线、反馈延迟和跨团队互动记录"],"label":"低信息基线与竞争机制入口","node_id":"NODE-BASELINE-UNKNOWN","node_type":"state","reverse_signals":["用户无法提供任何组织对象或时间窗"],"stop_conditions":["对象边界改变或现实授权被误写为分析结论"],"trigger_conditions":["材料只有用户姿态句，组织基线、办公形式与授权均未知"]},{"early_signals":["修复后反馈延迟和发声风险下降"],"label":"治理修复可解释的条件路径","node_id":"NODE-GOVERNANCE-OUTCOME","node_type":"outcome","reverse_signals":["治理质量稳定但信任仍跨岗位持续下降"],"stop_conditions":["保护底板失败或效果不能与现状区分"],"trigger_conditions":["反馈、文档、公平评价或申诉缺口与信任变化同向"]},{"early_signals":["弱联系、非正式反馈来源和新人桥接连续下降"],"label":"弱联系持续损失的条件路径","node_id":"NODE-WEAK-TIES-OUTCOME","node_type":"outcome","reverse_signals":["桥接关系恢复且信任没有继续下降"],"stop_conditions":["网络测量侵害隐私或不能区分沟通量与信任"],"trigger_conditions":["全远程持续、跨团队桥接减少且新人支持不足"]},{"early_signals":["新人和高互赖岗位的反馈、学习或评价风险先上升"],"label":"成本重分配与岗位分化的条件路径","node_id":"NODE-HETEROGENEITY-OUTCOME","node_type":"outcome","reverse_signals":["分层结果一致且成本没有向低权力位置集中"],"stop_conditions":["平均值掩盖局部损害或退出受到惩罚"],"trigger_conditions":["协作依赖、资历与照护资源使远程成本在位置间不均"]}],"run_id":"promax-green-v3-gpt-5-6-sol-a1-f2bde4ebcefa435fbf4be12cf278730b","schema_id":"crossframe.promax.v8.claim-path-graph","schema_version":1,"source_snapshot_sha256":"3186805a3e46e1b16948a4e51d08e7693a8e0dd04aa6b4604e796266d649936c","stance_neutral_problem":{"analysis_object":"远程办公对组织信任的影响","evidence_cutoff":"2026-07-23T00:00:00+08:00","proposition_under_test":"远程办公必然摧毁组织信任","semantic_key_sha256":"d917747fca3cb295271f85ab78fe168d7f480e48c6081c977b9f9e4e235c82ee","time_window":"未指定"},"updated_at":"2026-07-23T00:30:00+08:00"}
