{"central_claim_cycle":{"central_claim_id":"CLAIM-A2-CENTRAL","counterfactual":"若在预注册组织内比较中，各岗位与时间窗均出现由远程通道识别的持续信任下降，拒绝力度应下降或改判。","initial_judgment":"该绝对命题缺少个案材料，且外部研究显示远程形式的结果具有条件异质性。","revision":"将结论限定为否定“必然摧毁”，不把它升级为“绝不会损害”；远程安排在特定治理、岗位和时间窗下仍可能降低信任。","strongest_attack":"微软自然实验显示全员远程使协作网络更静态、更孤岛化；若信任依赖跨团队信息桥，远程可能通过该通道持续侵蚀组织信任。","withdrawal_conditions":["组织内重复测量和可信反事实显示远程安排在既定边界内一致、持续且实质性降低组织信任。","竞争机制被排除，且办公地点本身的指定通道效应跨团队、岗位和时间窗复现。"]},"central_claim_id":"CLAIM-A2-CENTRAL","choice_boundary":"外部研究只校准可能路径；没有个案事实或授权时，排序使用明确标注为非 v8 的低信息 ProMax 政策。","claims":[{"authorization_ceiling":"分析性判断，不授权现实处置。","claim_id":"CLAIM-A2-CENTRAL","claim_type":"mechanistic","concept_ids":["V8-CANON-D0","V8-CANON-E1","V8-CANON-E2","V8-CANON-E4","V8-CANON-G2","V8-CANON-H4"],"confidence":"medium","evidence_refs":["RETRIEVAL-A2-01","RETRIEVAL-A2-02","RETRIEVAL-A2-03","RETRIEVAL-A2-04","RETRIEVAL-A2-05","RETRIEVAL-A2-06","RETRIEVAL-A2-07"],"statement":"远程办公必然摧毁组织信任"}],"forecast_conditions":["只有取得组织内基线、重复测量、岗位分层和竞争机制区分后，才能给条件方向预测。","当前不能给具体概率、期限或统一效应大小。"],"mechanisms":[{"claim_ids":["CLAIM-A2-CENTRAL"],"distinguishing_conditions":["在远程比例相近时，沟通质量、支持、公平评价或监控方式的变化先于信任变化","改善治理后信任变化减弱，而办公地点保持不变"],"label":"治理与沟通质量中介机制","mechanism_id":"MECH-A2-GOVERNANCE"},{"claim_ids":["CLAIM-A2-CENTRAL"],"distinguishing_conditions":["跨团队弱联系和同步沟通减少先于组织信任下降","恢复跨团队桥接而不改变远程频率后，信任下降缓解"],"label":"协作拓扑收缩机制","mechanism_id":"MECH-A2-TOPOLOGY"},{"claim_ids":["CLAIM-A2-CENTRAL"],"distinguishing_conditions":["通勤负担降低、自主性或支持提升先于组织信任稳定或上升","取消自主性收益而保持远程形式后，信任增益消失"],"label":"自主与支持增益机制","mechanism_id":"MECH-A2-AUTONOMY"}],"path_edges":[{"condition":"桥接收缩或低质量沟通没有被治理补偿。","edge_id":"EDGE-A2-EROSION","from_node_id":"NODE-A2-BASE","mechanism_ids":["MECH-A2-TOPOLOGY","MECH-A2-GOVERNANCE"],"outcome_writeback":"记录岗位分层的信任下降、通道证据和停止条件。","to_node_id":"NODE-A2-EROSION"},{"condition":"制度透明、沟通质量与新人支持抵消空间分离。","edge_id":"EDGE-A2-STABLE","from_node_id":"NODE-A2-BASE","mechanism_ids":["MECH-A2-GOVERNANCE"],"outcome_writeback":"记录稳定范围，不把未下降写成绝对安全。","to_node_id":"NODE-A2-STABLE"},{"condition":"自主、通勤与支持收益可识别且没有保护降级。","edge_id":"EDGE-A2-GAIN","from_node_id":"NODE-A2-BASE","mechanism_ids":["MECH-A2-AUTONOMY"],"outcome_writeback":"记录增益及其岗位、时间窗和治理条件。","to_node_id":"NODE-A2-GAIN"}],"path_nodes":[{"early_signals":["沟通质量","跨团队弱联系","监控强度","新人求助可达性"],"label":"办公安排变化前的未知基线","node_id":"NODE-A2-BASE","node_type":"state","reverse_signals":["信任分量稳定","桥接恢复","表达安全改善"],"stop_conditions":["无基线或无法保护低权力成员时停止因果判断"],"trigger_conditions":["组织明确远程或混合办公安排及其自愿性"]},{"early_signals":["跨团队桥接持续减少"],"label":"信任下降路径","node_id":"NODE-A2-EROSION","node_type":"outcome","reverse_signals":["治理修复后信任恢复"],"stop_conditions":["竞争解释足以解释变化时停止归因"],"trigger_conditions":["指定风险通道与信任下降同窗出现"]},{"early_signals":["沟通质量和申诉可达性稳定"],"label":"信任稳定路径","node_id":"NODE-A2-STABLE","node_type":"outcome","reverse_signals":["低权力位置报告持续恶化"],"stop_conditions":["平均稳定遮蔽岗位差异时停止总体结论"],"trigger_conditions":["治理补偿抵消远程摩擦"]},{"early_signals":["组织信任与留任意愿上升"],"label":"信任提升路径","node_id":"NODE-A2-GAIN","node_type":"outcome","reverse_signals":["监控增强或支持撤回"],"stop_conditions":["收益只来自选择偏差时停止因果外推"],"trigger_conditions":["自主与支持收益超过协作摩擦"]}],"run_id":"promax-green-v4-gpt-5-6-sol-a2-9742973771c64e89813a768c7894faa8","schema_id":"crossframe.promax.v8.claim-path-graph","schema_version":1,"source_snapshot_sha256":"3186805a3e46e1b16948a4e51d08e7693a8e0dd04aa6b4604e796266d649936c","stance_neutral_problem":{"analysis_object":"远程办公对组织信任的影响","evidence_cutoff":"2026-07-23T00:00:00+08:00","proposition_under_test":"远程办公必然摧毁组织信任","semantic_key_sha256":"d917747fca3cb295271f85ab78fe168d7f480e48c6081c977b9f9e4e235c82ee","time_window":"未指定"},"updated_at":"2026-07-23T08:51:00Z"}
