{"central_claim_cycle":{"central_claim_id":"CLAIM-REMOTE-TRUST-INEVITABILITY","counterfactual":"若地点安排本身具有普遍必然效应，独立组织、岗位和治理条件的反向路径不应系统出现。","initial_judgment":"材料不足以支持“必然摧毁”的全称因果命题。","revision":"修正：把结论限定为拒绝“一定会摧毁”的必然性，而不否认某些条件下可能出现信任摩擦。","strongest_attack":"没有具体组织基线时，一般研究也不能替代个案因果判断。","withdrawal_conditions":["若同一组织的预注册、分岗位重复测量显示远程安排在替代机制后仍稳定造成不可接受的信任下降，则改变判断。"]},"central_claim_id":"CLAIM-REMOTE-TRUST-INEVITABILITY","choice_boundary":"分析可比较机制、风险和可逆性；具体组织的资源分配、试验与处置必须由另行授权的主体决定。","claims":[{"authorization_ceiling":"本 claim 只允许分析性判断，不授权现实组织处置。","claim_id":"CLAIM-REMOTE-TRUST-INEVITABILITY","claim_type":"factual","concept_ids":["V8-CANON-APP-ORG","V8-CANON-CIRCLE-CANDIDATE","V8-CANON-MULTICIRCLE-JOINT-OBJECT","V8-CANON-U02","V8-CANON-U06","V8-CANON-U07","V8-CANON-C3","V8-CANON-C6","V8-CANON-BRANCHING-PATH-GRAPH","V8-CANON-FORECAST-ACTION-CEILING","V8-CANON-SEL-AGT","V8-CANON-SIMPLE-FORECAST-BASELINE"],"confidence":"low","evidence_refs":["USER-A1","RETRIEVAL-REVERSE-1","RETRIEVAL-FAILURE-1"],"statement":"远程办公必然摧毁组织信任"}],"forecast_conditions":["只有取得同一组织的基线、岗位分层、重复测量和无报复申诉记录，才可把路径比较升格为有限预测。","一般研究只能提供机制候选与反例，不能取代该组织的因果识别。"],"mechanisms":[{"claim_ids":["CLAIM-REMOTE-TRUST-INEVITABILITY"],"distinguishing_conditions":["高互赖工作缺少可替代的非正式互动与及时澄清接口"],"label":"机制一：关系接触损失","mechanism_id":"MECH-RELATION-LOSS"},{"claim_ids":["CLAIM-REMOTE-TRUST-INEVITABILITY"],"distinguishing_conditions":["文档、反馈、公平评价和申诉接口能被成员稳定使用并可纠错"],"label":"机制二：治理替代与公平可见性","mechanism_id":"MECH-GOVERNANCE-SUBSTITUTION"},{"claim_ids":["CLAIM-REMOTE-TRUST-INEVITABILITY"],"distinguishing_conditions":["新人社会化、岗位可远程性和跨团队弱联系存在可测差异"],"label":"机制三：岗位与社会化异质性","mechanism_id":"MECH-ROLE-SOCIALIZATION"}],"path_edges":[{"condition":"仅在同一可比边界内记录到安排变化时才进入路径比较。","edge_id":"EDGE-BASELINE-CHANGE","from_node_id":"NODE-BASELINE","mechanism_ids":["MECH-RELATION-LOSS","MECH-GOVERNANCE-SUBSTITUTION","MECH-ROLE-SOCIALIZATION"],"outcome_writeback":"把时间顺序和岗位差异写回基线，而非从用户断言补全。","to_node_id":"NODE-REMOTE-CHANGE"},{"condition":"高互赖工作缺少可替代的非正式互动与及时澄清接口。","edge_id":"EDGE-CHANGE-FRICTION","from_node_id":"NODE-REMOTE-CHANGE","mechanism_ids":["MECH-RELATION-LOSS"],"outcome_writeback":"记录澄清延迟与弱联系，而不把它们自动等同于信任崩塌。","to_node_id":"NODE-RELATION-FRICTION"},{"condition":"文档、反馈、公平评价和申诉接口能被成员稳定使用并可纠错。","edge_id":"EDGE-CHANGE-GOVERNANCE","from_node_id":"NODE-REMOTE-CHANGE","mechanism_ids":["MECH-GOVERNANCE-SUBSTITUTION"],"outcome_writeback":"记录治理接口是否减少解释缺口和差别惩罚。","to_node_id":"NODE-GOVERNANCE-SUPPORT"},{"condition":"新人社会化、岗位可远程性和跨团队弱联系存在可测差异。","edge_id":"EDGE-FRICTION-OUTCOME","from_node_id":"NODE-RELATION-FRICTION","mechanism_ids":["MECH-RELATION-LOSS","MECH-ROLE-SOCIALIZATION"],"outcome_writeback":"将摩擦限制为条件性风险，并检查不同位置的可逆性。","to_node_id":"NODE-TRUST-FRICTION"},{"condition":"新人社会化、岗位可远程性和跨团队弱联系存在可测差异。","edge_id":"EDGE-GOVERNANCE-STABILITY","from_node_id":"NODE-GOVERNANCE-SUPPORT","mechanism_ids":["MECH-GOVERNANCE-SUBSTITUTION","MECH-ROLE-SOCIALIZATION"],"outcome_writeback":"把有效条件写回后续试探，不把稳定结果升级为普遍保证。","to_node_id":"NODE-CONDITIONAL-STABILITY"}],"path_nodes":[{"early_signals":["建立岗位分层与重复测量"],"label":"未知组织信任基线","node_id":"NODE-BASELINE","node_type":"state","reverse_signals":["基线显示变化早于远程安排"],"stop_conditions":["基线采集侵害隐私或引发报复"],"trigger_conditions":["需要比较远程安排前后的同口径记录"]},{"early_signals":["协作接口、响应和反馈节奏变化"],"label":"远程安排变化","node_id":"NODE-REMOTE-CHANGE","node_type":"event","reverse_signals":["安排未变化而信任指标先变化"],"stop_conditions":["安排变化伴随未审查的惩罚或监控"],"trigger_conditions":["有可识别的团队级远程安排变化"]},{"early_signals":["跨团队澄清延迟、误解和弱联系收缩"],"label":"关系接触摩擦路径","node_id":"NODE-RELATION-FRICTION","node_type":"state","reverse_signals":["替代接口改善且摩擦不升"],"stop_conditions":["出现报复、隐私侵害或关键服务下降"],"trigger_conditions":["高互赖工作缺少可替代的非正式互动与及时澄清接口"]},{"early_signals":["规则可解释、反馈可达、申诉有回写"],"label":"治理可见性支持路径","node_id":"NODE-GOVERNANCE-SUPPORT","node_type":"decision","reverse_signals":["工具转为监控或差别惩罚"],"stop_conditions":["保护底线被降级或退出受惩罚"],"trigger_conditions":["文档、反馈、公平评价和申诉接口能被成员稳定使用并可纠错"]},{"early_signals":["新人社会化困难与跨团队合作受阻"],"label":"可能的信任摩擦结果","node_id":"NODE-TRUST-FRICTION","node_type":"outcome","reverse_signals":["修复后不同位置的信任指标回升"],"stop_conditions":["证据不足以区分原因时停止升级结论"],"trigger_conditions":["关系接触摩擦持续且未被治理接口缓冲"]},{"early_signals":["公平评价与申诉记录改善且无报复"],"label":"条件性信任稳定结果","node_id":"NODE-CONDITIONAL-STABILITY","node_type":"outcome","reverse_signals":["低权力位置持续受损"],"stop_conditions":["把短期稳定误作永久普遍规律"],"trigger_conditions":["治理可见性支持路径持续并覆盖关键岗位差异"]}],"run_id":"promax-run-dd7c57f21d368fd0","schema_id":"crossframe.promax.v8.claim-path-graph","schema_version":1,"source_snapshot_sha256":"3186805a3e46e1b16948a4e51d08e7693a8e0dd04aa6b4604e796266d649936c","stance_neutral_problem":{"analysis_object":"远程办公对组织信任的影响","evidence_cutoff":"2026-07-23T00:00:00+08:00","proposition_under_test":"远程办公必然摧毁组织信任","semantic_key_sha256":"d917747fca3cb295271f85ab78fe168d7f480e48c6081c977b9f9e4e235c82ee","time_window":"未指定"},"updated_at":"2026-07-23T08:40:00+08:00"}
